A2: תוצאות סקר מרצים תשס"ג-תשס"ד - מיון לפי ציון ממוצע משוקלל
B4: סקר זה אינו סקר רשמי/מדוייק/מדעי והנו מבוסס על 1060 המלצות של 123 סטודנטים שחיוו דעתם לגבי 126 קורסים, ויש לראותו כפשוטו ובהקשר מלל ההמלצות המפורט
B5: לתשומת לבכם - ככל שמספר ההתייחסויות למרצה גדול יותר - כך ההמלצה מייצגת בצורה מדוייקת יותר, ולהיפך
B6: מומלץ להיזהר מהטיה קוגנטיבית, ולזכור שלכל אחד יש את הדעה הפרטית שלו והראיה הסובייקטיבית שלו...
B8: אחוז החסימה הוגדר ל-7 המלצות, שהן 82% מסך ההמלצות (878 המלצות)
A9: הוגדרו 6 קטגוריות צבעים - המלך , מצטיינים, טוב מאוד , טוב , סביר , ראוי לשיפור
B10: יצוינו לשבח - ידידיה שטרן (מספר 1 ללא עוררין) ודוד האן (היחיד שמופיע פעמיים ברשימת המצטיינים)
B11: יצוינו כראויים לשיפור - רון שפירא ואבי בל (היחידים שמופיעים פעמיים ברשימת המרצים הראויים לשיפור)
B13: הפרמטרים לקביעת המקום היחסי של כל מרצה/קורס ברשימה הנם (בסדר הזה):
B14: ציון ממוצע, מספר המלצות, יחס מצוינות (מומלץ-סה"כ), יחס סבירות (יחס מומלץ-אפשרי-סה"כ), יחס מומלץ-אפשרי, מלל ההמלצות
F16: התפלגות הציון | I16: מקדמי שקלול
A17: מקום יחסי | B17: שם מרצה ושם קורס | C17: ציון מצטבר | D17: מספר ההמלצות | E17: ציון ממוצע | F17: לא להתקרב | G17: אפשרי | H17: מומלץ | I17: יחס מצויינות | J17: יחס סבירות
B18: Grand Total | C18: =SUM(C19:C144) -> 8098 | D18: =SUM(D19:D144) -> 1060 | E18: =C18/D18 -> 7.6396226415094342 | F18: =SUM(F19:F144) -> 149 | G18: =SUM(G19:G144) -> 387 | H18: =SUM(H19:H144) -> 524 | I18: =H18/D18 -> 0.49433962264150944 | J18: =(H18+G18)/D18 -> 0.85943396226415092
A19: =ROW()-18 -> 1 | B19: שטרן ידידיה - חברות | C19: 455 | D19: 47 | E19: =C19/D19 -> 9.6808510638297864 | F19: 1 | G19: 2 | H19: 44 | I19: =H19/D19 -> 0.93617021276595747 | J19: =(H19+G19)/D19 -> 0.97872340425531912
A20: =ROW()-18 -> 2 | B20: האן דוד - אמצעי תשלום | C20: 237 | D20: 24 | E20: =C20/D20 -> 9.875 | G20: 1 | H20: 23 | I20: =H20/D20 -> 0.95833333333333337 | J20: =(H20+G20)/D20 -> 1
A21: =ROW()-18 -> 3 | B21: ברנד יצחק - משפט הלכה ורפואה | C21: 197 | D21: 20 | E21: =C21/D21 -> 9.85 | G21: 1 | H21: 19 | I21: =H21/D21 -> 00.95 | J21: =(H21+G21)/D21 -> 1
A22: =ROW()-18 -> 4 | B22: וינר דוד - סד"פ | C22: 295 | D22: 31 | E22: =C22/D22 -> 9.5161290322580641 | G22: 5 | H22: 26 | I22: =H22/D22 -> 0.83870967741935487 | J22: =(H22+G22)/D22 -> 1
A23: =ROW()-18 -> 5 | B23: האן דוד - חדלות פרעון | C23: 154 | D23: 16 | E23: =C23/D23 -> 9.625 | G23: 2 | H23: 14 | I23: =H23/D23 -> 0.875 | J23: =(H23+G23)/D23 -> 1
A24: =ROW()-18 -> 6 | B24: אלקינס דוד - מסים | C24: 110 | D24: 11 | E24: =C24/D24 -> 10.0 | H24: 11 | I24: =H24/D24 -> 1 | J24: =(H24+G24)/D24 -> 1
A25: =ROW()-18 -> 7 | B25: הולנדר זאב - מסים | C25: 131 | D25: 14 | E25: =C25/D25 -> 9.3571428571428577 | G25: 3 | H25: 11 | I25: =H25/D25 -> 0.7857142857142857 | J25: =(H25+G25)/D25 -> 1
A26: =ROW()-18 -> 8 | B26: ברודר ג'ודי - סייגים לאחריות פלילית | C26: 90 | D26: 9 | E26: =C26/D26 -> 10.0 | H26: 9 | I26: =H26/D26 -> 1 | J26: =(H26+G26)/D26 -> 1
A27: =ROW()-18 -> 9 | B27: כהן ציפורה - חברות | C27: 185 | D27: 20 | E27: =C27/D27 -> 9.25 | G27: 5 | H27: 15 | I27: =H27/D27 -> 0.75 | J27: =(H27+G27)/D27 -> 1
A28: =ROW()-18 -> 10 | B28: שפירא חיים - פורמליזם וערכים במשפט העברי | C28: 74 | D28: 8 | E28: =C28/D28 -> 9.25 | G28: 2 | H28: 6 | I28: =H28/D28 -> 0.75 | J28: =(H28+G28)/D28 -> 1
A29: =ROW()-18 -> 11 | B29: רוזנבלום שמואל - ניתוח דוחות פיננסיים | C29: 124 | D29: 13 | E29: =C29/D29 -> 9.5384615384615383 | G29: 2 | H29: 11 | I29: =H29/D29 -> 0.84615384615384615 | J29: =(H29+G29)/D29 -> 1
A30: =ROW()-18 -> 12 | B30: רובין יעקב - ראיות | C30: 341 | D30: 38 | E30: =C30/D30 -> 8.973684210526315 | G30: 13 | H30: 25 | I30: =H30/D30 -> 0.65789473684210531 | J30: =(H30+G30)/D30 -> 1
A31: =ROW()-18 -> 13 | B31: שמואלביץ דפנה - עבודה | C31: 365 | D31: 41 | E31: =C31/D31 -> 8.9024390243902438 | G31: 15 | H31: 26 | I31: =H31/D31 -> 0.63414634146341464 | J31: =(H31+G31)/D31 -> 1
A32: =ROW()-18 -> 14 | B32: סיני יובל - דיין ודיון במשפט העברי | C32: 91 | D32: 10 | E32: =C32/D32 -> 9.1 | G32: 3 | H32: 7 | I32: =H32/D32 -> 00.7 | J32: =(H32+G32)/D32 -> 1
A33: =ROW()-18 -> 15 | B33: שפי דב - בטחון צבא ומלחמה | C33: 145 | D33: 16 | E33: =C33/D33 -> 9.0625 | G33: 5 | H33: 11 | I33: =H33/D33 -> 0.6875 | J33: =(H33+G33)/D33 -> 1
A34: =ROW()-18 -> 16 | B34: פסרמן-יוזפוב לאה - ניירות ערך | C34: 105 | D34: 12 | E34: =C34/D34 -> 8.75 | F34: 1 | G34: 2 | H34: 9 | I34: =H34/D34 -> 0.75 | J34: =(H34+G34)/D34 -> 0.91666666666666663
A35: =ROW()-18 -> 17 | B35: אלדר שחר - אתיקה מקצועית | C35: 159 | D35: 18 | E35: =C35/D35 -> 8.8333333333333339 | G35: 7 | H35: 11 | I35: =H35/D35 -> 0.61111111111111116 | J35: =(H35+G35)/D35 -> 1
A36: =ROW()-18 -> 18 | B36: בן-נון חמי - סד"א | C36: 227 | D36: 26 | E36: =C36/D36 -> 8.7307692307692299 | G36: 11 | H36: 15 | I36: =H36/D36 -> 0.57692307692307687 | J36: =(H36+G36)/D36 -> 1
A37: =ROW()-18 -> 19 | B37: שוחט שאול - משפחה | C37: 132 | D37: 15 | E37: =C37/D37 -> 8.8 | G37: 6 | H37: 9 | I37: =H37/D37 -> 00.6 | J37: =(H37+G37)/D37 -> 1
A38: =ROW()-18 -> 20 | B38: זילברשץ יפה - בינלאומי פומבי | C38: 88 | D38: 10 | E38: =C38/D38 -> 8.8 | G38: 4 | H38: 6 | I38: =H38/D38 -> 00.6 | J38: =(H38+G38)/D38 -> 1
A39: =ROW()-18 -> 21 | B39: דגן צילי - מסים | C39: 112 | D39: 13 | E39: =C39/D39 -> 8.615384615384615 | G39: 6 | H39: 7 | I39: =H39/D39 -> 0.53846153846153844 | J39: =(H39+G39)/D39 -> 1
A40: =ROW()-18 -> 22 | B40: לורברבוים יאיר - צלם אלוהים בהלכה | C40: 68 | D40: 8 | E40: =C40/D40 -> 8.5 | G40: 4 | H40: 4 | I40: =H40/D40 -> 0.5 | J40: =(H40+G40)/D40 -> 1
A41: =ROW()-18 -> 23 | B41: דויטש אורנה - ניהול מו"מ וגישור | C41: 181 | D41: 22 | E41: =C41/D41 -> 8.2272727272727266 | F41: 2 | G41: 7 | H41: 13 | I41: =H41/D41 -> 0.59090909090909094 | J41: =(H41+G41)/D41 -> 0.90909090909090906
A42: =ROW()-18 -> 24 | B42: קנאור איריס - המערכת השיפוטית העליונה | C42: 58 | D42: 7 | E42: =C42/D42 -> 8.2857142857142865 | G42: 4 | H42: 3 | I42: =H42/D42 -> 0.42857142857142855 | J42: =(H42+G42)/D42 -> 1
A43: =ROW()-18 -> 25 | B43: הרמן עמוס - ביטוח | C43: 141 | D43: 18 | E43: =C43/D43 -> 7.833333333333333 | F43: 2 | G43: 7 | H43: 9 | I43: =H43/D43 -> 0.5 | J43: =(H43+G43)/D43 -> 0.88888888888888884
A44: =ROW()-18 -> 26 | B44: שפרבר אהרון - סד"א | C44: 272 | D44: 35 | E44: =C44/D44 -> 7.7714285714285714 | F44: 4 | G44: 14 | H44: 17 | I44: =H44/D44 -> 0.48571428571428571 | J44: =(H44+G44)/D44 -> 0.88571428571428568
A45: =ROW()-18 -> 27 | B45: האן דוד - חברות | C45: 110 | D45: 14 | E45: =C45/D45 -> 7.8571428571428568 | F45: 1 | G45: 7 | H45: 6 | I45: =H45/D45 -> 0.42857142857142855 | J45: =(H45+G45)/D45 -> 0.9285714285714286
A46: =ROW()-18 -> 28 | B46: פיש ורדה - משפט בתיאטרון | C46: 72 | D46: 9 | E46: =C46/D46 -> 8.0 | G46: 6 | H46: 3 | I46: =H46/D46 -> 0.33333333333333331 | J46: =(H46+G46)/D46 -> 1
A47: =ROW()-18 -> 29 | B47: חבה יעקב - ראיות | C47: 110 | D47: 14 | E47: =C47/D47 -> 7.8571428571428568 | G47: 10 | H47: 4 | I47: =H47/D47 -> 0.2857142857142857 | J47: =(H47+G47)/D47 -> 1
A48: =ROW()-18 -> 30 | B48: שוז רונה - בינלאומי פרטי | C48: 155 | D48: 20 | E48: =C48/D48 -> 7.75 | F48: 1 | G48: 12 | H48: 7 | I48: =H48/D48 -> 00.35 | J48: =(H48+G48)/D48 -> 00.95
A49: =ROW()-18 -> 31 | B49: קידר ניר - משפט והיסטוריה | C49: 152 | D49: 20 | E49: =C49/D49 -> 7.6 | F49: 1 | G49: 13 | H49: 6 | I49: =H49/D49 -> 00.3 | J49: =(H49+G49)/D49 -> 00.95
A50: =ROW()-18 -> 32 | B50: קלעי דינה - קנין רוחני | C50: 90 | D50: 12 | E50: =C50/D50 -> 7.5 | F50: 1 | G50: 7 | H50: 4 | I50: =H50/D50 -> 0.33333333333333331 | J50: =(H50+G50)/D50 -> 0.91666666666666663
A51: =ROW()-18 -> 33 | B51: מרגלית טלי - משפט חברה ותרבות | C51: 222 | D51: 30 | E51: =C51/D51 -> 7.4 | F51: 3 | G51: 17 | H51: 10 | I51: =H51/D51 -> 0.33333333333333331 | J51: =(H51+G51)/D51 -> 00.9
A52: =ROW()-18 -> 34 | B52: טמיר צבי - פטנטים | C52: 59 | D52: 8 | E52: =C52/D52 -> 7.375 | F52: 1 | G52: 4 | H52: 3 | I52: =H52/D52 -> 0.375 | J52: =(H52+G52)/D52 -> 0.875
A53: =ROW()-18 -> 35 | B53: שלינגר ריבי - דיוני (סד"א) | C53: 59 | D53: 8 | E53: =C53/D53 -> 7.375 | F53: 1 | G53: 4 | H53: 3 | I53: =H53/D53 -> 0.375 | J53: =(H53+G53)/D53 -> 0.875
A54: =ROW()-18 -> 36 | B54: ברנד יצחק - חיוב וקניין במשפט העברי | C54: 59 | D54: 8 | E54: =C54/D54 -> 7.375 | G54: 7 | H54: 1 | I54: =H54/D54 -> 0.125 | J54: =(H54+G54)/D54 -> 1
A55: =ROW()-18 -> 37 | B55: גלבוע מאיר - החקירה הפלילית | C55: 59 | D55: 8 | E55: =C55/D55 -> 7.375 | G55: 7 | H55: 1 | I55: =H55/D55 -> 0.125 | J55: =(H55+G55)/D55 -> 1
A56: =ROW()-18 -> 38 | B56: פלוצקי יורם - ביואתיקה | C56: 52 | D56: 7 | E56: =C56/D56 -> 7.4285714285714288 | G56: 6 | H56: 1 | I56: =H56/D56 -> 0.14285714285714285 | J56: =(H56+G56)/D56 -> 1
A57: =ROW()-18 -> 39 | B57: דויטש אורנה - חוזים מיוחדים | C57: 63 | D57: 9 | E57: =C57/D57 -> 7.0 | F57: 2 | G57: 3 | H57: 4 | I57: =H57/D57 -> 0.44444444444444442 | J57: =(H57+G57)/D57 -> 0.77777777777777779
A58: =ROW()-18 -> 40 | B58: זוהר צבי - סוציולוגיה של ההלכה | C58: 70 | D58: 10 | E58: =C58/D58 -> 7.0 | F58: 1 | G58: 7 | H58: 2 | I58: =H58/D58 -> 00.2 | J58: =(H58+G58)/D58 -> 00.9
A59: =ROW()-18 -> 41 | B59: אנקר אהרון - אתיקה מקצועית | C59: 63 | D59: 9 | E59: =C59/D59 -> 7.0 | F59: 1 | G59: 6 | H59: 2 | I59: =H59/D59 -> 0.22222222222222221 | J59: =(H59+G59)/D59 -> 0.88888888888888884
A60: =ROW()-18 -> 42 | B60: אלברשטיין מיכל - מבוא לתורת המשפט | C60: 109 | D60: 16 | E60: =C60/D60 -> 6.8125 | F60: 2 | G60: 11 | H60: 3 | I60: =H60/D60 -> 0.1875 | J60: =(H60+G60)/D60 -> 0.875
A61: =ROW()-18 -> 43 | B61: שפירא חיים - משפט ושיפוט במשנה ובתלמוד | C61: 67 | D61: 10 | E61: =C61/D61 -> 6.7 | F61: 2 | G61: 5 | H61: 3 | I61: =H61/D61 -> 00.3 | J61: =(H61+G61)/D61 -> 00.8
A62: =ROW()-18 -> 44 | B62: אהרוני-גולדנברג שרון - היבטים בדיני מחשבים | C62: 89 | D62: 14 | E62: =C62/D62 -> 6.3571428571428568 | F62: 5 | G62: 2 | H62: 7 | I62: =H62/D62 -> 0.5 | J62: =(H62+G62)/D62 -> 0.6428571428571429
A63: =ROW()-18 -> 45 | B63: קרייני מיכאיל - סד"א | C63: 50 | D63: 8 | E63: =C63/D63 -> 6.25 | F63: 2 | G63: 4 | H63: 2 | I63: =H63/D63 -> 0.25 | J63: =(H63+G63)/D63 -> 0.75
A64: =ROW()-18 -> 46 | B64: וורהפטיג איתמר - הגנת הצרכן במשפט העברי | C64: 50 | D64: 8 | E64: =C64/D64 -> 6.25 | F64: 2 | G64: 4 | H64: 2 | I64: =H64/D64 -> 0.25 | J64: =(H64+G64)/D64 -> 0.75
A65: =ROW()-18 -> 47 | B65: רונן יאיר - זכויות הילד | C65: 63 | D65: 12 | E65: =C65/D65 -> 5.25 | F65: 4 | G65: 7 | H65: 1 | I65: =H65/D65 -> 8.3333333333333329E-2 | J65: =(H65+G65)/D65 -> 0.66666666666666663
A66: =ROW()-18 -> 48 | B66: חבה יעקב - דיוני (ראיות) | C66: 41 | D66: 8 | E66: =C66/D66 -> 5.125 | F66: 3 | G66: 4 | H66: 1 | I66: =H66/D66 -> 0.125 | J66: =(H66+G66)/D66 -> 0.625
A67: =ROW()-18 -> 49 | B67: הלפרין-קדרי רות - משפחה | C67: 71 | D67: 17 | E67: =C67/D67 -> 4.1764705882352944 | F67: 9 | G67: 6 | H67: 2 | I67: =H67/D67 -> 0.11764705882352941 | J67: =(H67+G67)/D67 -> 0.47058823529411764
A68: =ROW()-18 -> 50 | B68: שרייבר צבי - עבודה | C68: 63 | D68: 15 | E68: =C68/D68 -> 4.2 | F68: 7 | G68: 8 | I68: =H68/D68 -> 0 | J68: =(H68+G68)/D68 -> 0.53333333333333333
A69: =ROW()-18 -> 51 | B69: בל אבי - מנהלי | C69: 55 | D69: 13 | E69: =C69/D69 -> 4.2307692307692308 | F69: 6 | G69: 7 | I69: =H69/D69 -> 0 | J69: =(H69+G69)/D69 -> 0.53846153846153844
A70: =ROW()-18 -> 52 | B70: כרם שלמה - נאמנויות | C70: 28 | D70: 7 | E70: =C70/D70 -> 4.0 | F70: 4 | G70: 2 | H70: 1 | I70: =H70/D70 -> 0.14285714285714285 | J70: =(H70+G70)/D70 -> 0.42857142857142855
A71: =ROW()-18 -> 53 | B71: בל אבי - ניתוח כלכלי | C71: 72 | D71: 21 | E71: =C71/D71 -> 3.4285714285714284 | F71: 13 | G71: 7 | H71: 1 | I71: =H71/D71 -> 4.7619047619047616E-2 | J71: =(H71+G71)/D71 -> 0.38095238095238093
A72: =ROW()-18 -> 54 | B72: זינגר שלום - תכנון ובניה | C72: 19 | D72: 7 | E72: =C72/D72 -> 2.7142857142857144 | F72: 5 | G72: 2 | I72: =H72/D72 -> 0 | J72: =(H72+G72)/D72 -> 0.2857142857142857
A73: =ROW()-18 -> 55 | B73: שפירא רון - סד"פ | C73: 38 | D73: 20 | E73: =C73/D73 -> 1.9 | F73: 17 | G73: 3 | I73: =H73/D73 -> 0 | J73: =(H73+G73)/D73 -> 00.15
A74: =ROW()-18 -> 56 | B74: שפירא רון - דיוני (סד"פ) | C74: 20 | D74: 14 | E74: =C74/D74 -> 1.4285714285714286 | F74: 13 | G74: 1 | I74: =H74/D74 -> 0 | J74: =(H74+G74)/D74 -> 7.1428571428571425E-2
B75: חן אביטל - תעבורה | C75: 30 | D75: 3 | H75: 3
B76: אנגל ישראל - אשנב לחשבונאות | C76: 20 | D76: 2 | H76: 2
B77: כץ גדעון - הזהות היהודית חילונית | C77: 20 | D77: 2 | H77: 2
B78: ספיר גידי וליפשיץ שחר - קורס רב-תחומי למצטיינים | C78: 20 | D78: 2 | H78: 2
B79: קרייני מיכאיל - בינלאומי פרטי | C79: 20 | D79: 2 | H79: 2
B80: שטרן ידידיה - סמינריון רכישת חברות | C80: 20 | D80: 2 | H80: 2
B81: שפרבר אהרון ופריש שרה - משפט מבויים | C81: 20 | D81: 2 | H81: 2
B82: אטינגר שמשון - ראיות במשפט העברי | C82: 10 | D82: 1 | H82: 1
B83: אלברשטיין מיכל - גישור בקהילה | C83: 10 | D83: 1 | H83: 1
B84: בנבג'י יצחק - זכויות מוסריות, פוליטיות ומשפטיות | C84: 10 | D84: 1 | H84: 1
B85: ברסטל-גינת חגית - מנהלי | C85: 10 | D85: 1 | H85: 1
B86: וינר דוד - קליניקה בסד"פ | C86: 10 | D86: 1 | H86: 1
B87: כהן עמיחי - הבחירה הציבורית והחוק | C87: 10 | D87: 1 | H87: 1
B88: לרנר שלום - אמצעי תשלום | C88: 10 | D88: 1 | H88: 1
B89: קלוגמן גדעון - מיסוי ענף ההייטק | C89: 10 | D89: 1 | H89: 1
B90: קליינמן רון - עשיית עושר במשפט הישראלי | C90: 10 | D90: 1 | H90: 1
B91: רדזינר עמיחי - היסודות ההלכתיים של דיני המשפחה | C91: 10 | D91: 1 | H91: 1
B92: שוז רונה - יחסים בין הורים וילדים | C92: 10 | D92: 1 | H92: 1
B93: שחר יורם - סמינריון בית המשפט העליון | C93: 10 | D93: 1 | H93: 1
B94: שפירא חיים - המסורת הפוליטית של עם ישראל | C94: 10 | D94: 1 | H94: 1
B95: אגרון גרי - מיסוי שוק ההון | C95: 37 | D95: 4 | G95: 1 | H95: 3
B96: בנבג'י יצחק - סיבתיות, אחריות ומזל מוסרי - תשסג | C96: 37 | D96: 4 | G96: 1 | H96: 3
B97: ברנד יצחק - ערכים וטעמים א' | C97: 37 | D97: 4 | G97: 1 | H97: 3
B98: כץ יוסף - סוגיות ברכישת קרקעות | C98: 54 | D98: 6 | G98: 2 | H98: 4
B99: פרז אורן - סחר בינלאומי | C99: 27 | D99: 3 | G99: 1 | H99: 2
B100: קנאי רות - עבירות המתה | C100: 27 | D100: 3 | G100: 1 | H100: 2
B101: רימלט נויה - תיאוריות פמיניסטיות של המשפט | C101: 34 | D101: 4 | G101: 2 | H101: 2
B102: שגב יהושע - משפט ואלימות | C102: 34 | D102: 4 | G102: 2 | H102: 2
B103: אורטל אברהם , שוורץ דוד - משפט אמריקאי | C103: 17 | D103: 2 | G103: 1 | H103: 1
B104: ברוך דותן - מיסוי מקרקעין לתואר ראשון | C104: 17 | D104: 2 | G104: 1 | H104: 1
B105: האן דוד - סמינריון חדלות פרעון | C105: 17 | D105: 2 | G105: 1 | H105: 1
B106: טימן שלי ובומבך אילן - היבטים אתיים בניהול משפט | C106: 17 | D106: 2 | G106: 1 | H106: 1
B107: קליינמן רון - ספרות השו"ת - משפט והסטוריה | C107: 17 | D107: 2 | G107: 1 | H107: 1
B108: הכהן אביעד - דת ומדינה | C108: 48 | D108: 6 | G108: 4 | H108: 2
B109: רובין יעקב - בוררות | C109: 48 | D109: 6 | G109: 4 | H109: 2
B110: אטינגר שמשון - דין ויושר במשפט העברי | C110: 24 | D110: 3 | G110: 2 | H110: 1
B111: מרגלית טלי - קנין, חברה ותרבות | C111: 24 | D111: 3 | G111: 2 | H111: 1
B112: זוהר צבי - ההלכה לנוכח חילון | C112: 38 | D112: 5 | F112: 1 | G112: 1 | H112: 3
B113: רכטשאפן שלומי - מחשבים ויזמות | C113: 35 | D113: 5 | F113: 1 | G113: 2 | H113: 2
B114: לידסקי נירה - מעצרים | C114: 21 | D114: 3 | F114: 1 | H114: 2
B115: כרם שלמה - חובות הנאמנים וזכויותיהם | C115: 14 | D115: 2 | G115: 2
B116: אולסן פרנסיס - תאוריות פמיניסטיות | C116: 7 | D116: 1 | G116: 1
B117: אלברשטיין מיכל - תורת המשפט והסכסוך | C117: 7 | D117: 1 | G117: 1
B118: בנבג'י יצחק - אידיאליזם של שיוויון | C118: 7 | D118: 1 | G118: 1
B119: בנבג'י יצחק - דלמות מוסריות והכרעות משפטיות | C119: 7 | D119: 1 | G119: 1
B120: חבה יעקב - נזיקין במשפט העברי | C120: 7 | D120: 1 | G120: 1
B121: חמדני אסף - מיסוי תאגידים | C121: 7 | D121: 1 | G121: 1
B122: פרקטיקה וסיוע משפטי | C122: 7 | D122: 1 | G122: 1
B123: קידר ניר - שיטת המשפט הקנדית | C123: 7 | D123: 1 | G123: 1
B124: קסטנבאום אריה - סמינריון הגבלים עסקיים | C124: 7 | D124: 1 | G124: 1
B125: רונן יאיר - זכויות אדם, סניגוריה ורב תרבותיות | C125: 7 | D125: 1 | G125: 1
B126: אלטשולר תהילה - חופש העיתונות | C126: 39 | D126: 6 | F126: 2 | G126: 1 | H126: 3
B127: זוהר צבי - התמודדות החכמים בארצות האיסלם | C127: 32 | D127: 5 | F127: 2 | H127: 3
B128: לורברבוים יאיר - מבוא לתורת המשפט | C128: 32 | D128: 5 | F128: 1 | G128: 3 | H128: 1
B129: בנבג'י יצחק - אחריות, סיבתיות ואשמה - תשסד | C129: 25 | D129: 4 | F129: 1 | G129: 2 | H129: 1
B130: קורינאלדי מיכאל - ירושה | C130: 36 | D130: 6 | F130: 2 | G130: 2 | H130: 2
B131: זינגר שלום - דיני רשויות מקומיות | C131: 18 | D131: 3 | F131: 1 | G131: 1 | H131: 1
B132: קלוגמן גדעון - מיסוי בינלאומי | C132: 18 | D132: 3 | F132: 1 | G132: 1 | H132: 1
B133: קנאי רות - ענישה | C133: 11 | D133: 2 | F133: 1 | H133: 1
B134: שטרום דרור - הגבלים עסקיים | C134: 11 | D134: 2 | F134: 1 | H134: 1
B135: הלר שלמה - דיני בנקאות | C135: 15 | D135: 3 | F135: 1 | G135: 2
B136: שרייבר צבי - אפליה בעבודה | C136: 15 | D136: 3 | F136: 1 | G136: 2
B137: פריד רחל - האיחוד האירופי | C137: 19 | D137: 4 | F137: 2 | G137: 1 | H137: 1
B138: אלטשולר תהילה - הסדרת שוק התקשורת | C138: 23 | D138: 5 | F138: 2 | G138: 3
B139: משגב חיים - דילמות במשפט הפלילי | C139: 16 | D139: 4 | F139: 2 | G139: 2
B140: הרמן עמוס - משפט ימי | C140: 8 | D140: 2 | F140: 1 | G140: 1
B141: וורהפטיג איתמר - צנעת הפרט במשפט העברי | C141: 8 | D141: 2 | F141: 1 | G141: 1
B142: רדזינר עמיחי - קנין במשפט העברי | C142: 21 | D142: 6 | F142: 4 | G142: 1 | H142: 1
B143: ברסטל-גינת חגית - דיני חינוך | C143: 9 | D143: 3 | F143: 2 | G143: 1
B144: ברסטל-גינת חגית - היבטים משפטיים במינהל המדינה | C144: 1 | D144: 1 | F144: 1
B145: Grand Total | C145: =SUM(C19:C144) -> 8098 | D145: =SUM(D19:D144) -> 1060 | E145: =C145/D145 -> 7.6396226415094342 | F145: =SUM(F19:F144) -> 149 | G145: =SUM(G19:G144) -> 387 | H145: =SUM(H19:H144) -> 524