A1: תוצאות סקר מרצים תשס"ג-תשס"ד
A2: ד"ר האן: קורס חברות, אמצעי תשלום, חדלות פרעון
A4: לתשומת לבכם - ככל שמספר ההתייחסויות למרצה גדול יותר - כך ההמלצה מייצגת בצורה מדוייקת יותר, ולהיפך
A5: מומלץ להיזהר מהטיה קוגנטיבית, ולזכור שלכל אחד יש את הדעה הפרטית שלו והראיה הסובייקטיבית שלו...
A7: הוגדרו 6 קטגוריות צבעים - המלך , מצטיינים, טוב מאוד , טוב , סביר , ראוי לשיפור
A9: הפרמטרים לקביעת המקום היחסי של כל מרצה/קורס ברשימה הנם (בסדר הזה):
A10: ציון ממוצע, מספר המלצות, יחס מצוינות (מומלץ-סה"כ), יחס סבירות (יחס מומלץ-אפשרי-סה"כ), יחס מומלץ-אפשרי, מלל ההמלצות
D12: התפלגות ההמלצות | G12: מקדמי שקלול
A13: מקום יחסי (מתוך 56 שדורגו בסקר) | B13: מספר ההמלצות | C13: ציון ממוצע | D13: לא להתקרב | E13: אפשרי | F13: מומלץ | G13: יחס מצויינות | H13: יחס סבירות
A14: אמצעי תשלום
A15: 2 | B15: 24 | C15: 9.9 | E15: 1 | F15: 23 | G15: =F15/B15 -> 0.95833333333333337 | H15: =(F15+E15)/B15 -> 1
A16: חדלות פרעון
A17: 5 | B17: 16 | C17: 9.6 | E17: 2 | F17: 14 | G17: =F17/B17 -> 0.875 | H17: =(F17+E17)/B17 -> 1
A18: חברות
A19: 27 | B19: 14 | C19: 7.9 | D19: 1 | E19: 7 | F19: 6 | G19: =F19/B19 -> 0.42857142857142855 | H19: =(F19+E19)/B19 -> 0.9285714285714286
A21: שקלול המלצה | B21: תיאור המלצה (מלל פתוח) | C21: מטלות | D21: חובת נוכחות/ דף מועבר/ חלק מהציון | E21: איך הבחינה? | F21: איך המרצה ? | G21: איך הקורס ?
A22: אמצעי תשלום
A23: אפשרי | B23: לא בשביל הציון, אבל מומלץ | C23: פס"ד, חשוב לקרוא כדי להבין | D23: אין | E23: בחינה קשה, הוא נגד ציונים מעל 95 | F23: מרצה חביב, משתדל להסביר שוב ושוב. לא תמיד מובן | G23: פרקטי לחיים, לא רק כעו"ד. קצת משעמם לעיתים
A24: מומלץ | B24: מומלץ | C24: אין | D24: אין | E24: בינונית עד מטעה, אירועונים | F24: בסדר, חריף, קריזיונר | G24: לא קל, חשוב לחיים
A25: מומלץ | B25: כדאי, מומלץ, חשוב לחיים וחשוב גם לראות מרצה שבוערת בו רוח ההוראה, כדאי ! | C25: נותן לקרוא חומר, אבל לא מחייב או בודק שנקרא | D25: אין | E25: בחינה קשה, כמו הקורס, עם חומר פתוח | F25: מקצועי , צעיר ונמרץ מלא אנרגיה, מומלץ בהחלט | G25: מעניין מאוד, פרקטי
A26: מומלץ | C26: אין | D26: אין | E26: בחינה לא קלה אבל אפשר להצליח מאחר והקורס מעניין ולומדים במשך כל הסמ' | F26: מקצועי, ברור, ניתן לסכם בקלות | G26: מעניין חיוני ופרקטי
A27: מומלץ | B27: כדאי ללמוד את הנושא בעיקר עם מרצה איכותי כמו האן אבל צריך לעקוב אחרי החומר אחרת קשה להשלים פערים | C27: אין ממש אבל כדאי לקרוא פס"ד | D27: אין | E27: בחינה קשה למדי | F27: מרצה מוצלח, ניכר שמתעניין בתחום ומוכן לעזור ולהסביר | G27: קורס מעניין ושימושי לחיים, רמת הקושי בהדרגה המרצה מחבר בין התאוריה ליישום בפועל
A28: מומלץ | B28: מרתק | C28: חומר קריאה | D28: אין | E28: ארועון קשה | F28: מלך ורציני | G28: מעניין
A29: מומלץ | B29: להגיע ולקרוא את מעט חומר הקריאה . כדאי | C29: אין | D29: לא | E29: פתוח.לא קל | F29: יהיר ולא מתחשב אך מעניין | G29: מעניין
A30: מומלץ | C30: צריך לקרוא פסקי דין קצרים, אחרת לא יודעים מה קרה שם | D30: אין | E30: קל, ציונים בינוניים לא טובים, ולא ברור גם למה... | F30: מעביר בצורה מאוד מענינת, ברור, חד, אבל קשה, לא נחמד, לא כל כך אנושי | G30: מעניין, פרקטי, חשוב
A31: מומלץ | B31: חובה | C31: אין | D31: אין | E31: ספרים פתוחים | F31: ענייני | G31: פרקטי
A32: מומלץ | B32: להולכים למשפט מסחרי, ולמתעניינים בתחום - כדאי. | C32: יש קריאה משיעור לשיעור. המרצה מלמד כאילו כולם קראו. | D32: אין | E32: אירועון סטנדרטי, לא מאוד מסובכת. | F32: מקצועי, מעביר שיעור רהוט ומעניין. מסביר שנית ועונה על שאלות ככל שנדרש. | G32: מעניין, חשוב ופרקטי ברובו.
A33: מומלץ | B33: לעו"ד צריך להיות קורס חובה | C33: אין | D33: אין | E33: הבחינה סבירה והציונים טובים מאד, חומר פתוח (אירועון) | F33: מקצועי, רהוט, סובלני, חביב, עונה על שאלות לפעמים יותר מדי | G33: חשוב, פרקטי
A34: מומלץ | B34: מקנה ידע חשוב לכל עו"ד ואזרח במקומותינו | C34: אין | D34: אין | E34: בחינה לא פשוטה | F34: מרצה ברור וקוהרנטי | G34: מעניין וחשוב
A35: מומלץ | B35: קשה ומומלץ | D35: אין | E35: ארועון שמקיף הרבה מאד חומר | F35: מעולה. בקורס השנה היה עוד יותר טוב מתמיד כי הכתה היתה קטנה יחסית | G35: מעניין ,חשוב, מעניק מושגי יסוד חשובים יחסית
A36: מומלץ | B36: כדאי ומומלץ– למי שהכיוון שלו זה משפט מסחרי או למי שרוצה לדעת דיני שטרות | C36: אין | D36: אין | E36: בחינה ברמת קושי סבירה, אירועון ארוך עם סעיפים, חומר פתוח | F36: מרצה מעולה, מסביר מצויין, מעניין ועונה על שאלות | G36: הקורס נחשב קצת קשה ומסובך, אבל חשוב ופרקטי
A37: מומלץ | C37: אין | D37: אין | E37: בחינה פתוחה. 3-4 שאלות פתוחות. בחינה הוגנת | F37: מרצה מעולה | G37: קורס חשוב,פרקטי. מי שלא קורא במהלך הקורס את החומר הנדרש – לא מצליח לעקוב אחר המרצה בשיעורים
A38: מומלץ | B38: חובה לקחת | C38: אין | D38: אין | E38: בחינה לא קשה, חוזרת על עצמה כל שנה | F38: מרצה מקצועי ביותר, עונה על כל השאלות | G38: קורס נחמד ביותר, חובה לקחת, פרקטי מאוד, מצויין אפילו לידע כללי
A39: מומלץ | B39: קורס מעולה-מומלץ! מומלץ מאוד | C39: אין | D39: אין | E39: בחינה פתוחה ברמת קושי בינונית | F39: המרצה הוא אחד המעניינים בפקולטה , מעודד חשיבה עצמית | G39: מעניין מאוד ופרקטי
A40: מומלץ | B40: קורס חובה לכל מי שרוצה להיכנס לתחום האזרחי בכלל ולמסחרי בפרט, זה יסוד ההוצל"פ! | C40: אין | D40: אין | E40: פתוחה, קשה אבל הוגנת ומורכבת | F40: מקצועי, קוהרנטי ובעל רהיטות דיבור מעולה, אבל לא מוכן לעזור לתלמידים, לא עונה על שאלות בסוף השעור. | G40: קשה אבל מעניין ופרקטי מאוד
A41: מומלץ | B41: אחלה קורס | C41: אין | D41: אין | E41: פתוח- חומר פתוח | F41: ברור ומקצועי | G41: פרקטי
A42: מומלץ | B42: מומלץ | C42: מומלץ להכין את השיעור | D42: אין חובת נוכחות אך מומלץ להגיע לשיעורים | E42: סבירה | F42: מרצה מקצועי בעל יכולת הוראה מאוד גבוהה. עונה לשאלות ומשתף את התלמידים וגורם להם לחשוב | G42: מעניין ומרתק
A43: מומלץ | B43: קורס מאוד מעניין- האן הוא אחד המרצים היותר טובים בפקולטה | C43: אין | D43: אין | E43: אירועון- לא קל בכלל | F43: אחלה מרצה- מסביר ממש טוב, ומוכן לחזור שוב אם לא מובן. מבקש השתתפות בשיעור והקשבה- אחרת 'תעצבן | G43: קורס קשה אבל מאוד מעניין, בנוי כהלכה ומוסבר טוב
A44: מומלץ | B44: שווה ביותר | C44: אין | D44: אין | E44: לא קשה אך יש לשלוט בחומר | F44: מקצועי | G44: מעניין
A45: מומלץ | D45: אין | E45: קשה, שאלות פתוחות, אירועון | F45: מקצועי, יכולת הוראה טובה, דיוק רב, מעניין | G45: מעניין, חשוב
A46: מומלץ | B46: מומלץ בחום | C46: חומר קריאה רב- רק עוזר לסטודנט. אפשר גם בלעדיו | D46: אין | E46: הוגנת | F46: מסביר את החומר בפירוט ובסבלנות. חוזר על החומר לטובת מתקשים. | G46: מעניין פרקטי רהוט
A47: חדלות פרעון
A48: אפשרי | B48: קורס לא קל, אבל יכול להיות מעניין. במיוחד למי שמתעניין במסחרי. אפשר | C48: יש קריאה משיעור לשיעור. המרצה מלמד כאילו כולם קראו. | D48: אין | E48: אירועון. לא קלה. | F48: יודע להעביר שיעור מסובך יחסית בצורה בהירה. | G48: מעניין בדרך כלל.
A49: מומלץ | B49: חובה למתעניינים בכינוס נכסים, פשיטת רגל ופירוקים. | C49: שניים עד שלושה פסקי דין כל שיעור, סעיפי חקיקה רבים. | D49: אין | E49: הבחינה כוללת אירועון אחד. איננה קלה כלל, יש להבין את החומר היטב. מי שסומך על לימוד חלקי, יקבל ציון חלקי. | F49: המרצה מקצועי, קפדן, מסקרן, הופך חומר "מסחרי יבש" למשהו שאפשר לחשוב עליו ולדון בו ברבדים עמוקים ביותר. רהוט בדיבורו, סבלן ומסייע לכל מי שמתקשה. | G49: מעניין.
A50: מומלץ | B50: קורס מעניין וחשוב למי שמתעניין בתחום המסחרי | C50: אין | D50: אין | E50: מבחן קשה, יש מוקשים אירועון אחד ושאלה קצרה | F50: מרצה מקצועי, מעניין, יודע להעביר שיעור, עונה על שאלות ובקיא בחומר | G50: מעניין
A51: מומלץ | B51: כדאי לקחת אחרי שיש בסיס של חברות, עדיף בשנה ג' | C51: אין | D51: אין | E51: רמת קושי בינונית, אירועון, הרבה פרטים קטנים ,חומר פתוח | F51: מקצועי, מעניין, עונה על השאלות | G51: קשה, מעניין
A52: מומלץ | B52: חשוב למי שהולך לכיוון המסחרי במיוחד כיום | C52: אין | D52: אין | E52: הבחינה סבירה והציונים טובים מאד, חומר פתוח (אירועון) | F52: מקצועי, רהוט, סובלני, חביב, עונה על שאלות לפעמים יותר מדי | G52: חשוב, פרקטי
A53: מומלץ | B53: מעניין וחשוב בעיקר למי שהתחום המסחרי הוא משאת נפשו | C53: אין | D53: אין | E53: בחינה סבירה מבחינת "תחכום" אך נוטה לבלבל בשל עומס פרטים | F53: מרצה ברור וקוהרנטי | G53: מעניין וחשוב
A54: מומלץ | B54: למי שלא מפחד מקורסים מאתגרים, והציון עלול להיות נמוך . | D54: אין | E54: ארועון ארוך ודי קשה –מכיל חישובים מספריים מתישים | F54: מרצה מעולה- כל מה שכתבו בשנתיים האחרונות נכון | G54: מעניין ,חשוב, מעניק מושגי יסוד חשובים יחסית
A55: מומלץ | C55: אין | D55: אין | E55: בחינה פתוחה. 3-4 שאלות פתוחות. בחינה הוגנת | F55: מרצה מעולה | G55: קורס חשוב,פרקטי.
A56: מומלץ | B56: קורס מעניין, מרצה נהדר, בחינה סבירה, יש מחברת של דב כהן ובקיצור כל הסיבות הטובות | C56: אין | D56: אין | E56: אירועון פתוח ברמה הוגנת , עושה רושם שישנו צ'ק ליסט | F56: מרצה ראוי בעל איכויות רבות המקנה ערך מוסף בלתי מבוטל, כה לחי! | G56: מעניין למי שמתעניין בתחום החברות.
A57: מומלץ | B57: קורס חשוב לכל מי שחושב ללכת למסחרי, אבל רק אחרי שלומדים חברות!!! | C57: אין | D57: אין | E57: פתוחה, קשה אבל הוגנת ומורכבת | F57: מקצועי, קוהרנטי ובעל רהיטות דיבור מעולה, אבל לא מוכן לעזור לתלמידים, לא עונה על שאלות בסוף השעור. | G57: קשה אבל מעניין ופרקטי מאוד
A58: מומלץ | B58: קורס לא רע | C58: אין | D58: אין | E58: בחינה פתוחה עם חומר פתוח. | F58: מרצה טוב ומוכשר, שמסביר את החומר טוב. | G58: חומר לא הכי מעניין בעולם, אך סביר
A59: מומלץ | B59: למי שמתעניין –קורס טוב | C59: אין | D59: אין | E59: פתוח- חומר פתוח | F59: ברור ומקצועי | G59: מעניין למתעניינים במשפט מסחרי
A60: אפשרי | B60: למי שמעניין אותו התחום מומלץ לקחת את הקורס למרות שהמבחן קשה | C60: מומלץ להכין את השיעור | D60: אין | E60: קשה | F60: מרצה מקצועי בעל יכולת הוראה מאוד גבוהה. עונה לשאלות ומשתף את התלמידים וגורם להם לחשוב | G60: מעניין מאוד
A61: מומלץ | B61: מומלץ בהחלט!!! | C61: אין | D61: אין | E61: הוגנת וסבירה, קצת קשה כי מקיפה המון חומר ונקודות קטנות. חומר פתוח | F61: מאוד ברור, מרצה מצויין. | G61: חשוב
A62: מומלץ | B62: מומלץ בחום. | C62: אין | D62: אין | E62: קשה קשה אבל אפשרית. | F62: המרצה מדהים. | G62: מעניין מאד.
A63: מומלץ | B63: מרצה מצויין, קורס מאוד מעניין | C63: אין | D63: אין | E63: בין בינוני לקשה | F63: מצויין | G63: מעניין, פרקטי
A64: חברות
A65: אפשרי | B65: כדאי ללמוד אצלנו,שכן הוא מרצה הפתוח לשינויים ולהארות | C65: אין | D65: אין | E65: בחינה קשה מאוד!!!,אולם הנרמול מסייע כאן. | F65: כאדם הוא מאוד סימפטי ונינוח,אולם הלימוד שלו לא ענייני,מפוזר מאוד,לא ברור,מדבר הרבה מאוד על דין אמריקאי שהוא מאוד לא חשוב | G65: ככלל קורס חשוב
A66: אפשרי | B66: לדעתי עדיף לקחת אצל שטרן | C66: חובת קריאה | D66: אין | E66: בחינה קשה מאוד-רוב מוחץ של הכיתה ענו על 2 מתוך 4 שאלות בלבד | F66: רהוט מאוד,עונה על שאלות, קפדן מאוד, מוכן לעזור | G66: קשה מאוד,פרקטי מאוד, מרתק
A67: אפשרי | B67: . מרצה מעולה, מבחנים הסטריים, הציונים התפלגו באופן די חד. לדעתי עדיף שטרן | C67: חובת קריאה משיעור לשיעור , הייתה אמורה להיות עבודה 1 אבל הוא ויתר בסוף. | D67: אין | E67: קשה קשה קשה עד כדי כך שיש שאלות שבקושי אפשר לפתור. חומר פתוח אבל אין זמן להסתכל | F67: מקצועי, מדבר באופן ברור, מקשיב לסטודנטים, אוהב לעשות דיונים בכתה, מוכן לעזור, מסביר בצורה ברורה מאד | G67: מעניין, חשוב למתעניינים באזרחי/מסחרי
A68: אפשרי | B68: קורס די חשוב. המרצה משווה בין דיני החברות בארץ וארה"ב- וזה מעיק. יש לקרוא פס"ד באנגלית | C68: סיליבוס עמוס + פס"ד אמריקאיים | D68: אין | E68: קשה מאוד, אך רוב הציונים היו גבוהים (בניגוד לציפיות). ספרים פתוחים | F68: המרצה ברור, עונה על שאלות, מסביר היטב | G68: קורס חשוב, קשה במקצת ומעניין
A69: אפשרי | B69: קורס לא פשוט וגם לא מעניין כמו שחושבים, אבל האן משפר את המצב. | C69: חומר קריאה לכל שיעור וחלק לא מבוטל באנגלית.אבוי. | D69: אין | E69: ארוכה (אירועון שכלל שלושה עמודים) וקשה להפליא. | F69: האן הוא מרצה מצויין, אך הקורסים האחרים שהוא מעביר הם מעניינים יותר. אולי משום שמדובר בקורס בסיסי, אז אופן הלימוד הוא שונה | G69: קורס סביר, לתומי חשבתי שנושא החברות יהיה מעניין יותר. המרצה נוטה להתמקד בפסיקה מארה"ב והדבר מקשה על ההבנה.
A70: מומלץ | B70: פשוט קורס מעולה ויישר כוח למרצה על העבודה הקשה וההכנה המרובה לכל שיעור ושיעור, נהניתי מכל רגע (טוב לא מהכל אבל מהרב). מומלץ ביותר | C70: אין בחנים ועבודות . חומר קריאה מגוון ולא כולל רק פסקי דין וחקיקה, כמו כן פסיקה לא מעטה באנגלית | D70: אין | E70: ארוע 1 ענקי, עליו נשאלנו 4 שאלות. הבחינה היתה קשה מאוד אבל הבדיקה היתה הוגנת והנרמול עבד כמו שהוא אמור לעבוד | F70: המרצה מעולה - השיעור זורם, לא מכתיב ! הרוב מתנהל בשיחה עם התלמידים. רהוט , מדבר בשטף, עונה על שאלות ודלתו תמיד פתוחה לשאלות | G70: הקורס חשוב ביותר ! אפילו הכרחי, מענין ומרתק
A71: מומלץ | C71: הרבה חומר קריאה | D71: אין חובת נוכחות אבל קשה לעקוב אחריו אם מפסידים כמה הרצאות. נוכחות בשיעורים מוסיפה המון מבחינת הבנת החומר. | E71: קשה, אירועון ארוך עם הרבה פרטים ו-5-6 שאלות בסוף.חומר פתוח | F71: מקצועי, מרתק, מעניין, עונה על השאלות, מעלה לדיון בכיתה סוגיות שדרכן מעביר רציונלים של הקורס. | G71: מעניין, פרקטי,מפתח חשיבה אנליטית. קורס קשה אבל מרתק למי שמוכן להשקיע.
A72: מומלץ | B72: נפלא. מומלץ בחום | C72: אין | D72: אין | E72: קשה, אבל הנרמול עבד.. | F72: אגדי. מרצה סבלני מאוד, מעניין | G72: פרקטי, מדהים
A73: אפשרי | B73: אלמלא הבחינה המזעזעת הייתי ממליץ בחום אך הבחינה הצליחה להכעיס את רובנו | C73: היתה אמורה להיות עבודה בהתאם לסילבוס,אבל לבסוף לא חולקה | D73: אין | E73: החלק היותר טראומתי של השנה ,בחינה קשה ביותר ,בלתי פתירה בעליל,ארועון ארוך ורווי פרטים.את הציונים שנתן לא ניתן היה להסביר.(לא בהכרח טובים) | F73: בעל יכולות דידקטיות ממעלה ראשונה ,מנסה לעשות כמיטב יכולתו ע"מ שהחומר יהא מעניין לא תמיד מצליח אבל לא באשמתו. בעיקרון מרצה מיקצועי ורהוט משתדל להיות ברור ככל יכולתו. | G73: מעניין לפרקים
A74: לא להתקרב | B74: קורס לא מעניין ולא פרקטי בכלל למרות הצפיות הגבוהות | C74: אין | D74: אין | E74: בחינה קשה ביותר. 4 שעות מבחן. מורכב מארועון אחד ענק!!! המכיל את כל החומר הנלמד ואף יותר | F74: מרצה מקצועי, עונה על שאלות | G74: משעמם, מתיש, לא חשוב, לא מתעסק עם הדברים הפרקטים אלא יותר עם השוואה לנעשה בחו"ל
A75: מומלץ | B75: מומלץ, אך הבחינה הייתה קשה יחסית. הציונים נורמלו חזק למעלה. | C75: אין | D75: אין | E75: הבחינה עם ספרים פתוחים- אירועון של שני עמודים. קשה וארוכה | F75: המרצה מלמד בלהט ורגש, מוכן לעזור, ועונה באריכות על שאלות (מקור בלתי נדלה לידע). מצטיין מבחינה אישית ומקצועית. | G75: הקורס מעניין מאוד, ופרקטי.
A76: אפשרי | B76: נחמד בזמן הלימוד אך סיוטי בבחינה. אפשרי תלוי אם מצב רוחו של המרצה בשעת כתיבת הבחינה שפרה עליו. | C76: אין | D76: אין | E76: בחינה לא ברורה בעליל. קשה בטירוף. לא ברור אם המרצה מודע למה שחיבר | F76: רהוט ומקצועי, אחד שמשחק אותה חברה'מן, אך קלקל הכל בבחינה | G76: קורס מעניין למדי אך משופע בפסיקה אמריקאית לא בהכרח רלוונטית
A77: מומלץ | B77: למי שמתעניין בתחום - הקורס יוצא מן הכלל, גם אם הבחינה מוציאה קצת את החשק. | C77: בעקרון יש עבודות, אך פתוח לפשרות. | D77: אין | E77: בחינה מהסיוטים. אירועון אינסופי עם 30 דמויות ושאלות שלא מוליכות לכלום. | F77: המרצה מקצועי ביותר, רהוט וחד מחשבה. גם הנושאים המסובכים ביותר הוסברו כראוי. עונה ברצון על שאלות. | G77: קורס מעניין וחשוב מאד, גם אם נוטה לעיתים קרובות לכיוונים לא רלוונטיים לחוק הישראלי.
A78: מומלץ | B78: בסה"כ די חייבים את הקורס. גם המרצה בסדר. | C78: נותן לקרוא. היתה אמורה להיות עבודה אך בסוף לא היתה. | D78: אין | E78: טרוף חושים,הסיפור שאינו נגמר. להפתעתי בא הנירמול וחולל נפלאות. | F78: בחור נחמד,מסביר טוב. לפעמים אבל היה נראה שהוא מדבר בצורה שרק מי שקורא יבין. | G78: חשוב,פרקטי אבל לא קל